filename,test_name,test_id,issue_severity,issue_confidence,issue_cwe,issue_text,line_number,col_offset,end_col_offset,line_range,more_info
repo_files\eval_usage.py,blacklist,B307,MEDIUM,HIGH,https://cwe.mitre.org/data/definitions/78.html,Use of possibly insecure function - consider using safer ast.literal_eval.,2,11,27,[2],https://bandit.readthedocs.io/en/1.7.8/blacklists/blacklist_calls.html#b307-eval
repo_files\hardcoded_password.py,hardcoded_password_string,B105,LOW,MEDIUM,https://cwe.mitre.org/data/definitions/259.html,Possible hardcoded password: 'SuperSecretPassword123!',3,15,40,[3],https://bandit.readthedocs.io/en/1.7.8/plugins/b105_hardcoded_password_string.html
repo_files\insecure_hash.py,hashlib,B324,HIGH,HIGH,https://cwe.mitre.org/data/definitions/327.html,Use of weak MD5 hash for security. Consider usedforsecurity=False,5,11,43,[5],https://bandit.readthedocs.io/en/1.7.8/plugins/b324_hashlib.html
repo_files\insecure_randomness.py,blacklist,B311,LOW,HIGH,https://cwe.mitre.org/data/definitions/330.html,Standard pseudo-random generators are not suitable for security/cryptographic purposes.,5,11,33,[5],https://bandit.readthedocs.io/en/1.7.8/blacklists/blacklist_calls.html#b311-random
repo_files\insecure_storage.py,hashlib,B324,HIGH,HIGH,https://cwe.mitre.org/data/definitions/327.html,Use of weak MD5 hash for security. Consider usedforsecurity=False,5,22,52,[5],https://bandit.readthedocs.io/en/1.7.8/plugins/b324_hashlib.html
repo_files\sql_injection.py,hardcoded_sql_expressions,B608,MEDIUM,LOW,https://cwe.mitre.org/data/definitions/89.html,Possible SQL injection vector through string-based query construction.,5,14,52,[5],https://bandit.readthedocs.io/en/1.7.8/plugins/b608_hardcoded_sql_expressions.html
repo_files\xss_example.py,flask_debug_true,B201,HIGH,MEDIUM,https://cwe.mitre.org/data/definitions/94.html,"A Flask app appears to be run with debug=True, which exposes the Werkzeug debugger and allows the execution of arbitrary code.",12,4,23,[12],https://bandit.readthedocs.io/en/1.7.8/plugins/b201_flask_debug_true.html
